[
  {
    "id": "99999999-9999-4999-8999-999999999999",
    "siteId": "11111111-1111-4111-8111-111111111111",
    "code": "OT-2026-014",
    "sourceTankId": "33333333-3333-4333-8333-333333333333",
    "targetTankId": "55555555-5555-4555-8555-555555555555",
    "lotId": "66666666-6666-4666-8666-666666666666",
    "requestedVolumeLiters": 2500,
    "status": "pending_approval",
    "requestedBy": "bbbbbbbb-bbbb-4bbb-8bbb-bbbbbbbbbbbb",
    "requestedAt": "2026-05-18T09:00:00.000Z",
    "createdAt": "2026-05-18T09:00:00.000Z",
    "updatedAt": "2026-05-18T09:00:00.000Z"
  }
]
